{
  "schema_version": "1.0.0",
  "review_version": "post-repair-semantic-verification-v1",
  "review_date": "2026-08-14",
  "frozen_pre_repair_review": {
    "path": "evals/rag_real_world_corpus/v1/gold/v1/independent_semantic_verification_v1.json",
    "sha256": "89bf00e924579c1c68a88a952797d4bfb73bccab0f7ba8ffe28bb74e5888279d"
  },
  "post_repair_gold_sha256": "33a0b69901fa47e3fe45be0277228cd4a5519fe780fe5b9d2c52b1bfe614927a",
  "review_method": {
    "incremental_semantic_closure": true,
    "previously_supported_claim_payloads_compared": 96,
    "fresh_repaired_claim_review": true,
    "fresh_corpus_reopen": true,
    "llm_used": false,
    "baseline_output_used": false,
    "retrieval_output_used": false,
    "production_rag_used": false
  },
  "repaired_semantic_claim_total": 8,
  "claim_reviews": [
    {
      "case_id": "rw-gold-v1-semantic-checkpointer-store",
      "claim_id": "rw-gold-v1-semantic-checkpointer-store-claim-01",
      "question": "为什么长期运行的 agent 既要有 durable execution 与 memory 能力，又要区分 thread-scoped checkpoint 和跨 thread store？",
      "claim": "LangGraph's high-level capabilities and persistence guide both support durable continuity and memory for long-running agents.",
      "old_verdict": "PARTIALLY_SUPPORTED",
      "new_verdict": "SUPPORTED",
      "group_combination_logic": "AND",
      "new_evidence_groups": [
        {
          "group_id": "eg-rw-semantic-checkpointer-store-01",
          "logic": "OR",
          "candidate_anchors": [
            {
              "evidence_id": "ev-rw-agent-overview-capabilities",
              "document_id": "rw-agent-langgraph-overview",
              "locator": {
                "kind": "SOURCE_LINES",
                "source_path": "evals/rag_real_world_corpus/v1/corpus/rw-agent-langgraph-overview.md",
                "start_line": 35,
                "end_line": 46,
                "section_title": "Why use LangGraph?",
                "region": "middle"
              },
              "source_bytes_sha256": "4b5bf18421432989b6e46f22751fed5d0a14a908628e039fc6e1d6543d1e858c",
              "fresh_text_sha256": "9c4065e0151576379bb8016217fcad4843acf70d51f60a8bd09a23f565569ad4",
              "fresh_evidence_excerpt": "## Why use LangGraph? LangGraph provides low-level supporting infrastructure for *any* long-running, stateful workflow or agent: - **[Durable execution](https://docs.langchain.com/oss/python/langgraph/durable-execution)** — Build agents that persist through failures and can run for extended periods, automatically resuming from exactly where they left off. - **[Human-in-the-loop](https://docs.langchain.com/oss/python/langgraph/interrupts)** — Seamlessly incorporate human oversight by inspecting and modifying agent state at any point during execution. - **[Comprehensive memory](https://docs.langchain.com/oss/python/langgraph/memory)** — Create truly stateful agents with both short-term working memory for ongoing reasoning and long-term persistent memory across sessions. - **[Debugging with LangSmith](https://www.langchain.com/langsmith)** — Gain deep visibility into complex agent behavior ",
              "locator_resolved": true,
              "source_hash_matches_manifest": true,
              "anchor_hash_matches": true,
              "candidate_semantic_verdict": "SUPPORTED",
              "review_reason": "The overview directly supplies durable execution and comprehensive memory for long-running agents."
            }
          ],
          "group_verdict": "SUPPORTED",
          "review_reason": "The candidate evidence directly supports this independently required group obligation."
        },
        {
          "group_id": "eg-rw-semantic-checkpointer-store-03",
          "logic": "OR",
          "candidate_anchors": [
            {
              "evidence_id": "ev-rw-persist-overview",
              "document_id": "rw-agent-persistence",
              "locator": {
                "kind": "SOURCE_LINES",
                "source_path": "evals/rag_real_world_corpus/v1/corpus/rw-agent-persistence.txt",
                "start_line": 14,
                "end_line": 21,
                "section_title": "Persistence overview",
                "region": "early"
              },
              "source_bytes_sha256": "0b2be3426fc43a7d5da8d98f316ca93a1e4951e47a12d286d1fdb2d5a3edfc17",
              "fresh_text_sha256": "bb61e8fdbf7a513cace0d00e478afff294a4756605b9e123de06c26202e034bb",
              "fresh_evidence_excerpt": "Persistence lets LangGraph applications keep useful information beyond a single graph run. It matters when an agent needs to continue a conversation, resume after an interruption, recover from a failure, or remember information across interactions. LangGraph provides two complementary persistence systems: - **[Checkpointers](/oss/langgraph/checkpointers)** persist a thread's graph state as checkpoints. Use them for short-term, thread-scoped memory, including conversation continuity, human-in-the-loop workflows, time travel, and fault tolerance. - **[Stores](/oss/langgraph/stores)** persist application-defined data outside the graph state. Use them for long-term, cross-thread memory, including user preferences, facts, and shared knowledge. Most applications can use both: a [checkpointer](/oss/langgraph/checkpointers) tracks the current thread, and a [store](/oss/langgraph/stores) tracks d",
              "locator_resolved": true,
              "source_hash_matches_manifest": true,
              "anchor_hash_matches": true,
              "candidate_semantic_verdict": "SUPPORTED",
              "review_reason": "The persistence guide directly supplies durable continuity plus thread-scoped and cross-thread memory systems."
            }
          ],
          "group_verdict": "SUPPORTED",
          "review_reason": "The candidate evidence directly supports this independently required group obligation."
        }
      ],
      "claim_verdict": "SUPPORTED",
      "review_reason": "The two source-specific facts are now separate required groups, so the claim's 'both' semantics is represented as AND.",
      "fresh_corpus_reopen": true,
      "authoring_verdict_used": false
    },
    {
      "case_id": "rw-gold-v1-long-langgraph-positioning",
      "claim_id": "rw-gold-v1-long-langgraph-positioning-claim-02",
      "question": "LangGraph 在长文档开头如何定位自身：它面向哪类 agent，又强调给开发者哪两类底层控制？",
      "claim": "It emphasizes control over both agent workflows and agent state.",
      "old_verdict": "PARTIALLY_SUPPORTED",
      "new_verdict": "SUPPORTED",
      "group_combination_logic": "AND",
      "new_evidence_groups": [
        {
          "group_id": "eg-rw-long-langgraph-positioning-01",
          "logic": "OR",
          "candidate_anchors": [
            {
              "evidence_id": "ev-rw-agent-overview-purpose",
              "document_id": "rw-agent-langgraph-overview",
              "locator": {
                "kind": "SOURCE_LINES",
                "source_path": "evals/rag_real_world_corpus/v1/corpus/rw-agent-langgraph-overview.md",
                "start_line": 22,
                "end_line": 33,
                "section_title": "Repository overview",
                "region": "early"
              },
              "source_bytes_sha256": "4b5bf18421432989b6e46f22751fed5d0a14a908628e039fc6e1d6543d1e858c",
              "fresh_text_sha256": "a325a3906f87659672179b65c8ca85bc9b989acab8d6b485131b8ea00f97ed40",
              "fresh_evidence_excerpt": "<br> Trusted by companies shaping the future of agents – including Klarna, Replit, Elastic, and more – LangGraph is a low-level orchestration framework for building, managing, and deploying long-running, stateful agents. ```bash pip install -U langgraph ``` > [!TIP] > If you're looking to quickly build agents, check out **[Deep Agents](https://docs.langchain.com/oss/python/deepagents/overview)** — a higher-level package built on LangGraph for agents that can plan, use subagents, and leverage file systems for complex tasks. For an equivalent JS/TS library, check out [LangGraph.js](https://github.com/langchain-ai/langgraphjs) and the [JS docs](https://docs.langchain.com/oss/javascript/langgraph/overview).",
              "locator_resolved": true,
              "source_hash_matches_manifest": true,
              "anchor_hash_matches": true,
              "candidate_semantic_verdict": "SUPPORTED",
              "review_reason": "Building, managing, and deploying agents through low-level orchestration supports workflow-level control."
            }
          ],
          "group_verdict": "SUPPORTED",
          "review_reason": "The candidate evidence directly supports this independently required group obligation."
        },
        {
          "group_id": "eg-rw-long-langgraph-positioning-02",
          "logic": "OR",
          "candidate_anchors": [
            {
              "evidence_id": "ev-rw-agent-overview-capabilities",
              "document_id": "rw-agent-langgraph-overview",
              "locator": {
                "kind": "SOURCE_LINES",
                "source_path": "evals/rag_real_world_corpus/v1/corpus/rw-agent-langgraph-overview.md",
                "start_line": 35,
                "end_line": 46,
                "section_title": "Why use LangGraph?",
                "region": "middle"
              },
              "source_bytes_sha256": "4b5bf18421432989b6e46f22751fed5d0a14a908628e039fc6e1d6543d1e858c",
              "fresh_text_sha256": "9c4065e0151576379bb8016217fcad4843acf70d51f60a8bd09a23f565569ad4",